{
  "schema_version": "1.0",
  "project_id": "4e82aee9-c7d0-4c1d-a522-d45b2a61048f",
  "task_id": "pmp-1.0-implementation",
  "scope_ref": "docs/OWNER_SCOPE.md",
  "phase": "verifying",
  "status": "paused",
  "completed": [
    "Core CLI, contracts, watcher, recovery, guarded synchronization, 90-test suite and disposable pilot implemented and locally verified"
  ],
  "in_progress": [
    "Authorized public GitHub development checkpoint and CI verification"
  ],
  "blockers": [
    "Native agent sessions and remote cross-platform CI require verification; stable release remains unauthorized"
  ],
  "next_actions": [
    "Verify exact remote SHA and CI, record limitations, then resume acceptance checks in a later session"
  ],
  "release_authorization": null
}
